{
  "$schema": "https://github.com/Katr1na9/project05-zotero-research/schemas/cost_profile.schema.json",
  "profile_id": "project05-measured-cost-v0.1",
  "version": "0.1.0-draft",
  "status": "draft",
  "regime": "measured",
  "created_utc": "2026-07-14T08:20:48Z",
  "standard_ref": "08-writing/cost-assignment-standard-v0.1-20260714.md",
  "notes": [
    "Generated without modifying case action files.",
    "Planner outcomes and expected-effect scores are excluded from rating packets.",
    "run_mvp.py rejects this profile until it is complete and frozen."
  ],
  "scope": {
    "case_ids": [
      "C01-linux-provenance",
      "C02-freebsd-provenance",
      "C03-windows-host",
      "C04-darpa-e3-fivedirections",
      "C05-darpa-e3-cadets",
      "C06-darpa-e3-cadets-0412",
      "C07-darpa-e5-theia-0515",
      "C08-darpa-e5-clearscope-0515",
      "C09-darpa-optc-sysclient0201-0923",
      "C10-darpa-optc-sysclient0351-0925",
      "C11-otrf-apt29-day1-scranton-nashua",
      "C12-witfoo-precinct6-f10c7270"
    ]
  },
  "scoring": {
    "method": "precomputed_continuous",
    "unit": "normalized relative operational cost",
    "formula": "TBD before profile freeze: operational metric normalization"
  },
  "actions": [
    {
      "case_id": "C01-linux-provenance",
      "action_id": "C01-AA-001",
      "legacy_cost": 2.0,
      "components": {
        "E": null,
        "V": null,
        "D": null,
        "A": null,
        "R": null
      },
      "measured_cost": null,
      "measurement_evidence": {
        "case_events_scanned": null,
        "recoverable_matched_event_count": null,
        "observed_window_seconds": null,
        "bytes_scanned": null,
        "retention_window_days": null,
        "host_count": null,
        "limitations": [
          "case_events_scanned is compilation-wide, not action-specific",
          "recoverable_matched_event_count is observed yield, not scan cost",
          "observed_window_seconds is evidence span, not retention lifetime",
          "bytes_scanned, retention_window_days, and host_count require new measurement",
          "no motif_report.json is available for this case"
        ]
      },
      "rating_status": "not_applicable",
      "evidence_refs": [
        "09-experiments/examples/C01/acquisition_actions.json"
      ],
      "notes": [
        "Draft only; no component or measured cost is frozen.",
        "Legacy cost is retained for audit and is not an input to blinded rating."
      ]
    },
    {
      "case_id": "C01-linux-provenance",
      "action_id": "C01-AA-002",
      "legacy_cost": 3.0,
      "components": {
        "E": null,
        "V": null,
        "D": null,
        "A": null,
        "R": null
      },
      "measured_cost": null,
      "measurement_evidence": {
        "case_events_scanned": null,
        "recoverable_matched_event_count": null,
        "observed_window_seconds": null,
        "bytes_scanned": null,
        "retention_window_days": null,
        "host_count": null,
        "limitations": [
          "case_events_scanned is compilation-wide, not action-specific",
          "recoverable_matched_event_count is observed yield, not scan cost",
          "observed_window_seconds is evidence span, not retention lifetime",
          "bytes_scanned, retention_window_days, and host_count require new measurement",
          "no motif_report.json is available for this case"
        ]
      },
      "rating_status": "not_applicable",
      "evidence_refs": [
        "09-experiments/examples/C01/acquisition_actions.json"
      ],
      "notes": [
        "Draft only; no component or measured cost is frozen.",
        "Legacy cost is retained for audit and is not an input to blinded rating."
      ]
    },
    {
      "case_id": "C01-linux-provenance",
      "action_id": "C01-AA-003",
      "legacy_cost": 2.0,
      "components": {
        "E": null,
        "V": null,
        "D": null,
        "A": null,
        "R": null
      },
      "measured_cost": null,
      "measurement_evidence": {
        "case_events_scanned": null,
        "recoverable_matched_event_count": null,
        "observed_window_seconds": null,
        "bytes_scanned": null,
        "retention_window_days": null,
        "host_count": null,
        "limitations": [
          "case_events_scanned is compilation-wide, not action-specific",
          "recoverable_matched_event_count is observed yield, not scan cost",
          "observed_window_seconds is evidence span, not retention lifetime",
          "bytes_scanned, retention_window_days, and host_count require new measurement",
          "no motif_report.json is available for this case"
        ]
      },
      "rating_status": "not_applicable",
      "evidence_refs": [
        "09-experiments/examples/C01/acquisition_actions.json"
      ],
      "notes": [
        "Draft only; no component or measured cost is frozen.",
        "Legacy cost is retained for audit and is not an input to blinded rating."
      ]
    },
    {
      "case_id": "C01-linux-provenance",
      "action_id": "C01-AA-004",
      "legacy_cost": 2.0,
      "components": {
        "E": null,
        "V": null,
        "D": null,
        "A": null,
        "R": null
      },
      "measured_cost": null,
      "measurement_evidence": {
        "case_events_scanned": null,
        "recoverable_matched_event_count": null,
        "observed_window_seconds": null,
        "bytes_scanned": null,
        "retention_window_days": null,
        "host_count": null,
        "limitations": [
          "case_events_scanned is compilation-wide, not action-specific",
          "recoverable_matched_event_count is observed yield, not scan cost",
          "observed_window_seconds is evidence span, not retention lifetime",
          "bytes_scanned, retention_window_days, and host_count require new measurement",
          "no motif_report.json is available for this case"
        ]
      },
      "rating_status": "not_applicable",
      "evidence_refs": [
        "09-experiments/examples/C01/acquisition_actions.json"
      ],
      "notes": [
        "Draft only; no component or measured cost is frozen.",
        "Legacy cost is retained for audit and is not an input to blinded rating."
      ]
    },
    {
      "case_id": "C01-linux-provenance",
      "action_id": "C01-AA-005",
      "legacy_cost": 4.0,
      "components": {
        "E": null,
        "V": null,
        "D": null,
        "A": null,
        "R": null
      },
      "measured_cost": null,
      "measurement_evidence": {
        "case_events_scanned": null,
        "recoverable_matched_event_count": null,
        "observed_window_seconds": null,
        "bytes_scanned": null,
        "retention_window_days": null,
        "host_count": null,
        "limitations": [
          "case_events_scanned is compilation-wide, not action-specific",
          "recoverable_matched_event_count is observed yield, not scan cost",
          "observed_window_seconds is evidence span, not retention lifetime",
          "bytes_scanned, retention_window_days, and host_count require new measurement",
          "no motif_report.json is available for this case"
        ]
      },
      "rating_status": "not_applicable",
      "evidence_refs": [
        "09-experiments/examples/C01/acquisition_actions.json"
      ],
      "notes": [
        "Draft only; no component or measured cost is frozen.",
        "Legacy cost is retained for audit and is not an input to blinded rating."
      ]
    },
    {
      "case_id": "C01-linux-provenance",
      "action_id": "C01-AA-006",
      "legacy_cost": 1.0,
      "components": {
        "E": null,
        "V": null,
        "D": null,
        "A": null,
        "R": null
      },
      "measured_cost": null,
      "measurement_evidence": {
        "case_events_scanned": null,
        "recoverable_matched_event_count": null,
        "observed_window_seconds": null,
        "bytes_scanned": null,
        "retention_window_days": null,
        "host_count": null,
        "limitations": [
          "case_events_scanned is compilation-wide, not action-specific",
          "recoverable_matched_event_count is observed yield, not scan cost",
          "observed_window_seconds is evidence span, not retention lifetime",
          "bytes_scanned, retention_window_days, and host_count require new measurement",
          "no motif_report.json is available for this case"
        ]
      },
      "rating_status": "not_applicable",
      "evidence_refs": [
        "09-experiments/examples/C01/acquisition_actions.json"
      ],
      "notes": [
        "Draft only; no component or measured cost is frozen.",
        "Legacy cost is retained for audit and is not an input to blinded rating."
      ]
    },
    {
      "case_id": "C01-linux-provenance",
      "action_id": "C01-AA-007",
      "legacy_cost": 3.0,
      "components": {
        "E": null,
        "V": null,
        "D": null,
        "A": null,
        "R": null
      },
      "measured_cost": null,
      "measurement_evidence": {
        "case_events_scanned": null,
        "recoverable_matched_event_count": null,
        "observed_window_seconds": null,
        "bytes_scanned": null,
        "retention_window_days": null,
        "host_count": null,
        "limitations": [
          "case_events_scanned is compilation-wide, not action-specific",
          "recoverable_matched_event_count is observed yield, not scan cost",
          "observed_window_seconds is evidence span, not retention lifetime",
          "bytes_scanned, retention_window_days, and host_count require new measurement",
          "no motif_report.json is available for this case"
        ]
      },
      "rating_status": "not_applicable",
      "evidence_refs": [
        "09-experiments/examples/C01/acquisition_actions.json"
      ],
      "notes": [
        "Draft only; no component or measured cost is frozen.",